{"chunks":[{"modulus_max":70,"modulus_min":2,"path":"forms-0000002-0000070.json","sha256":"629a012e48d20ddb8b972ca2d5506f84a1b2260535ab9b1982251f615038c3db","solutions":893},{"modulus_max":109,"modulus_min":71,"path":"forms-0000071-0000109.json","sha256":"ab8edf2e7b9deb041a732adc05c036f611446eb552a771ca78cb9390add0d5ba","solutions":503},{"modulus_max":140,"modulus_min":110,"path":"forms-0000110-0000140.json","sha256":"b2de688ef313a06b8453ae5ceea4fb569f2ede34caa7aee75adfb9b25a60d56d","solutions":387},{"modulus_max":176,"modulus_min":141,"path":"forms-0000141-0000176.json","sha256":"c0e58e644eeefacc406176a0edbcfa898353b9dd2f48d83fb3ab00f607db8a67","solutions":298},{"modulus_max":216,"modulus_min":177,"path":"forms-0000177-0000216.json","sha256":"6a6b7a93273a7c81d2f8ef5e5ea002b2cb14f418f6fddf35fe24ef673ec1259a","solutions":243},{"modulus_max":243,"modulus_min":217,"path":"forms-0000217-0000243.json","sha256":"3313204fe20a3d57d77f472bd677140184518f2c447bda56c2db1c2daee5f2df","solutions":214},{"modulus_max":287,"modulus_min":244,"path":"forms-0000244-0000287.json","sha256":"d5581628110a57f6b788966de1f9b1eef99c9cb6af0c84c3485f4535e457abc3","solutions":353},{"modulus_max":729,"modulus_min":288,"path":"forms-0000288-0000729.json","sha256":"19baf34500f1d93100098c8c41243d6d39456b69bb6796c258e4615205ea7f53","solutions":1693},{"modulus_max":1870,"modulus_min":730,"path":"forms-0000730-0001870.json","sha256":"33caf2b33ecdfc06dac9af46b28e6d3a0aecc87a307cd77cf080dab858fa5df4","solutions":1680},{"modulus_max":14363,"modulus_min":1871,"path":"forms-0001871-0014363.json","sha256":"bf8c09c8effa2133fa05dc4f31450387af806c060eff3a083333b44510a9d8f7","solutions":1591},{"modulus_max":1819961,"modulus_min":14381,"path":"forms-0014381-1819961.json","sha256":"662da52d2611cbb09f35aff5cf88177b10a05aaab506139e22f49479a053c84e","solutions":1048}],"data_version":"0.2.0","excluded":[{"count":514,"note":"the encoding search of verify/modular_forms.py exceeds its fixed work budget, so the encoding cannot be rebuilt and checked","reason":"coverage_cost_cap"},{"count":109,"note":"verify/modular_forms.py counts holes different from those given with the construction","reason":"holes_differ_from_input"},{"count":2,"note":"no residue has an encoding on one side, so no pair can be checked","reason":"no_served_residue"},{"count":1546,"note":"the denominator is not a unit modulo the modulus, so checking the construction with verify/modular_forms.py needs its encoding table, and tables are not stored for moduli above 256","reason":"nonunit_denominator_needs_table"}],"excluded_list":{"path":"forms-excluded.json","sha256":"eac74404c440156b52985e8612b58e42ea3800a73c42a13880580ad77f2ab273"},"kind":"modular_forms_index","prime_powers":[{"exponent":1,"holes":{"A":0,"B":0,"exact":true},"id":"awem2_60e5930fde366c74753409c36332a12672daaad6c7a2919b744c1ed4ca9e9930","kind":"hole_free","modulus":2,"planes":[1,1],"prime":2,"products":1,"value_set":"2xE2M1"},{"exponent":1,"holes":{"A":0,"B":0,"exact":true},"id":"awem2_667f52ac2ad219fcd82432c130a53e903111414927087aef8de7258508c7c0e6","kind":"hole_free","modulus":3,"planes":[1,1],"prime":3,"products":1,"value_set":"2xE2M1"},{"exponent":2,"holes":{"A":0,"B":0,"exact":true},"id":"awem2_16fdd92555ae30bdc4c8fe7626354598500ec2a1d004222ec4592152573ac93c","kind":"hole_free","modulus":4,"planes":[1,1],"prime":2,"products":1,"value_set":"2xE2M1"},{"exponent":1,"holes":{"A":0,"B":0,"exact":true},"id":"awem2_50b57013f125cde2ff48befffb30ec4fb9e4912029b5561c36f8ee9d45adf909","kind":"hole_free","modulus":5,"planes":[1,1],"prime":5,"products":1,"value_set":"2xE2M1"},{"exponent":3,"holes":{"A":0,"B":0,"exact":true},"id":"awem2_6bf04a676ff99975ccb955b084df7f69a108a69af9399ae748a834fc2f501ee9","kind":"hole_free","modulus":8,"planes":[1,1],"prime":2,"products":1,"value_set":"2xE2M1"},{"exponent":2,"holes":{"A":0,"B":0,"exact":true},"id":"awem2_1e12a4099d01bda74585b8658a7c63576b9b107b48f59b649d8629bc151798e3","kind":"hole_free","modulus":9,"planes":[1,1],"prime":3,"products":1,"value_set":"2xE2M1"},{"exponent":1,"holes":{"A":0,"B":0,"exact":true},"id":"awem2_6a9c670036b47e559a93aac132df6a4882ffb452da18ce0803b96eddf829e102","kind":"hole_free","modulus":11,"planes":[1,1],"prime":11,"products":1,"value_set":"2xE2M1"},{"exponent":1,"holes":{"A":0,"B":0,"exact":true},"id":"awem2_621769c45b0369a4367bea34cae296e2b3f53e4043071e43be745d4499bc58c5","kind":"hole_free","modulus":13,"planes":[1,1],"prime":13,"products":1,"value_set":"2xE2M1"},{"exponent":4,"holes":{"A":0,"B":0,"exact":true},"id":"awem2_21704388e118281c5fb8b42554d93f61e73199c843e6106c240320109f71e16b","kind":"hole_free","modulus":16,"planes":[2,2],"prime":2,"products":2,"value_set":"16xE3M2"},{"exponent":4,"holes":{"A":0,"B":0,"exact":true},"id":"awem2_0e37800d638cf47ef0669c650eca25e47e141d23186771b1c5e6abedf78a1733","kind":"hole_free","modulus":16,"planes":[2,2],"prime":2,"products":2,"value_set":"2xE2M1"},{"exponent":4,"holes":{"A":0,"B":0,"exact":true},"id":"awem2_6f4ee0563ac040227421715325a36613cdc091da4b639a462f9b9ea36b3570cf","kind":"hole_free","modulus":16,"planes":[2,2],"prime":2,"products":2,"value_set":"8xE2M3"},{"exponent":1,"holes":{"A":0,"B":0,"exact":true},"id":"awem2_073881662fc9d4721e98948e94205a96b5fcb48b9c8a839d0c38b87bdbe6518a","kind":"hole_free","modulus":17,"planes":[3,3],"prime":17,"products":3,"value_set":"2xE2M1"},{"exponent":1,"holes":{"A":2,"B":2,"exact":true},"id":"awem2_36734d1b5f95bb03705505b730eef764a56cc42115677c36af1ea3f1a5df1b3b","kind":"holes","modulus":17,"planes":[3,3],"prime":17,"products":1,"value_set":"2xE2M1"},{"exponent":1,"holes":{"A":0,"B":0,"exact":true},"id":"awem2_0ca0ab9e76ace510d62b6e5ef5846c6a6c931d7861d97af4012aa4cacc2844c8","kind":"hole_free","modulus":19,"planes":[3,3],"prime":19,"products":3,"value_set":"2xE2M1"},{"exponent":1,"holes":{"A":4,"B":4,"exact":true},"id":"awem2_c70d5f88c425ea3a6769c22c0e5a735274f1a902a7d52f57e388ae53770e80e8","kind":"holes","modulus":19,"planes":[1,1],"prime":19,"products":1,"value_set":"2xE2M1"},{"exponent":1,"holes":{"A":0,"B":0,"exact":true},"id":"awem2_e2c6d242857d876a4d1b734eca9ef38af46933d43a68edb27a9682ff62ad066e","kind":"hole_free","modulus":19,"planes":[1,1],"prime":19,"products":1,"value_set":"8xE2M3"},{"exponent":1,"holes":{"A":0,"B":0,"exact":true},"id":"awem2_0b5b4f8482653838f51b9142640ec404cdccbf5b1a61e30ac3be7845ab610202","kind":"hole_free","modulus":23,"planes":[3,3],"prime":23,"products":3,"value_set":"2xE2M1"},{"exponent":1,"holes":{"A":8,"B":0,"exact":true},"id":"awem2_6eeaecfa2315e8bf017533261a048134676f6526010d8666d6dc8cc5e4efb908","kind":"holes","modulus":23,"planes":[1,2],"prime":23,"products":2,"value_set":"2xE2M1"},{"exponent":2,"holes":{"A":0,"B":0,"exact":true},"id":"awem2_c1582cf80d7681ca31e0e7a61560ff59b89d79e610cf2243617f56285ae5db8e","kind":"hole_free","modulus":25,"planes":[2,2],"prime":5,"products":2,"value_set":"16xE3M2"},{"exponent":2,"holes":{"A":0,"B":0,"exact":true},"id":"awem2_08702a54704b4ca1a175a49393eaf1cd268c3c2954f3488c54a0279dbbf7f113","kind":"hole_free","modulus":25,"planes":[2,2],"prime":5,"products":3,"value_set":"2xE2M1"},{"exponent":2,"holes":{"A":0,"B":0,"exact":true},"id":"awem2_837bbaa7e9e5e0b14994919d65476ed0796fb2d5703dba428e9514cb0a2e97b1","kind":"hole_free","modulus":25,"planes":[2,2],"prime":5,"products":2,"value_set":"8xE2M3"},{"exponent":3,"holes":{"A":2,"B":2,"exact":true},"id":"awem2_5e0a552105dddf5056509205f9dcce6777f545129f4ca030c5d3ff61140cd1d7","kind":"holes","modulus":27,"planes":[2,2],"prime":3,"products":2,"value_set":"16xE3M2"},{"exponent":3,"holes":{"A":0,"B":0,"exact":true},"id":"awem2_0cf0f8abf77205e67e1aaa3194ebdef1cfcbcb84a5997e162e427f7874f1efe9","kind":"hole_free","modulus":27,"planes":[2,2],"prime":3,"products":2,"value_set":"2xE2M1"},{"exponent":3,"holes":{"A":0,"B":0,"exact":true},"id":"awem2_23ed642cdff5d2f31796e86aa786738558281fba5d842b100594591c0927209a","kind":"hole_free","modulus":27,"planes":[2,2],"prime":3,"products":2,"value_set":"8xE2M3"},{"exponent":1,"holes":{"A":0,"B":0,"exact":true},"id":"awem2_172e079f7318d8ce9c14b86593106a8bf049c4480aeeb77717860d74991061a9","kind":"hole_free","modulus":29,"planes":[3,3],"prime":29,"products":3,"value_set":"2xE2M1"},{"exponent":1,"holes":{"A":14,"B":0,"exact":true},"id":"awem2_3a5d255e43a790d19789800b264b9d172e55a24880bb15122ff9e275cb2888f6","kind":"holes","modulus":29,"planes":[1,2],"prime":29,"products":2,"value_set":"2xE2M1"},{"exponent":1,"holes":{"A":0,"B":0,"exact":true},"id":"awem2_4013fbd7a46911ecfda1dbeb1d208d668d47f3254611e858c5f74d318f78c769","kind":"hole_free","modulus":31,"planes":[3,3],"prime":31,"products":3,"value_set":"2xE2M1"},{"exponent":5,"holes":{"A":0,"B":0,"exact":true},"id":"awem2_00c4d0310a76005a7773597670b12c6f13ed8b195cfa4690a5f62c93a22a25d0","kind":"hole_free","modulus":32,"planes":[2,2],"prime":2,"products":2,"value_set":"16xE3M2"},{"exponent":5,"holes":{"A":8,"B":0,"exact":true},"id":"awem2_2b9e30a4933f78ac74c3741943a03f2ca70b4d9d77aa2b79efff38d43739be2e","kind":"holes","modulus":32,"planes":[2,2],"prime":2,"products":2,"value_set":"16xE3M2"},{"exponent":5,"holes":{"A":0,"B":0,"exact":true},"id":"awem2_64d069a5ca1c13c030b568a462bbb17306804f685a31ef01e6b97d3aa9ac20b2","kind":"hole_free","modulus":32,"planes":[2,2],"prime":2,"products":3,"value_set":"2xE2M1"},{"exponent":5,"holes":{"A":2,"B":2,"exact":true},"id":"awem2_21ed7438fc547e552061d14c0072ac5d30320073cb8f7e1796a20b5089b257bf","kind":"holes","modulus":32,"planes":[3,3],"prime":2,"products":3,"value_set":"2xE2M1"},{"exponent":5,"holes":{"A":0,"B":0,"exact":true},"id":"awem2_201cbbf1cfac7a1f765782b5f44fc70e6971b7dd6eb4fa3dafaa5cca7f651d90","kind":"hole_free","modulus":32,"planes":[2,2],"prime":2,"products":2,"value_set":"8xE2M3"},{"exponent":1,"holes":{"A":0,"B":0,"exact":true},"id":"awem2_02e45b7103b01532693f931e19d05bf63d8b6d9f309da8714dfcd1b4696b2c2d","kind":"hole_free","modulus":37,"planes":[3,3],"prime":37,"products":3,"value_set":"2xE2M1"},{"exponent":1,"holes":{"A":4,"B":4,"exact":true},"id